{
  "course_code": "MST300",
  "course_name": "Introduction to Microsoft Cloud Technologies",
  "credits": 3.0,
  "term": "Fall 2026 / Semester 3",
  "is_technical": true,
  "grading_type": "percentage_gpa",
  "syllabus_file": "syllabi-2267-mst300-nbb-5219-loggedin.pdf",
  "grade_scale": "Seneca 4.0",
  "passing_criteria": [
    "Achieve a grade of 50% or higher in the overall course",
    "Achieve a weighted average of 50% or higher on all labs",
    "Achieve a weighted average of 50% or higher on all projects"
  ],
  "categories": [
    {
      "category_id": "budget",
      "name": "Management of Budget Allotment",
      "weight_percent": 10.0,
      "drop_lowest_n": 0,
      "items": [
        {
          "id": "mst300-budget",
          "name": "Budget Allotment",
          "weight_percent": 10.0,
          "max_points": 100,
          "earned_points": null,
          "due_date": null,
          "status": "Not Started"
        }
      ]
    },
    {
      "category_id": "labs",
      "name": "Labs",
      "weight_percent": 20.0,
      "drop_lowest_n": 0,
      "hurdle_min_percent": 50.0,
      "hurdle_description": "Weighted average of 50% or higher on all labs",
      "items": [
        {
          "id": "mst300-lab-1",
          "name": "Lab 1",
          "weight_percent": 3.33,
          "max_points": 100,
          "earned_points": null,
          "due_date": "2026-10-13",
          "status": "Not Started"
        },
        {
          "id": "mst300-lab-2",
          "name": "Lab 2",
          "weight_percent": 3.33,
          "max_points": 100,
          "earned_points": null,
          "due_date": "2026-10-6",
          "status": "Not Started"
        },
        {
          "id": "mst300-lab-3",
          "name": "Lab 3",
          "weight_percent": 3.33,
          "max_points": 100,
          "earned_points": null,
          "due_date": "2026-10-6",
          "status": "Not Started"
        },
        {
          "id": "mst300-lab-4",
          "name": "Lab 4",
          "weight_percent": 3.33,
          "max_points": 100,
          "earned_points": null,
          "due_date": "2026-10-6",
          "status": "Not Started"
        },
        {
          "id": "mst300-lab-5",
          "name": "Lab 5",
          "weight_percent": 3.33,
          "max_points": 100,
          "earned_points": null,
          "due_date": "2026-10-6",
          "status": "Not Started"
        },
        {
          "id": "mst300-lab-6",
          "name": "Lab 6",
          "weight_percent": 3.35,
          "max_points": 100,
          "earned_points": null,
          "due_date": "2026-10-6",
          "status": "Not Started"
        }
      ]
    },
    {
      "category_id": "quizzes",
      "name": "Quizzes",
      "weight_percent": 15.0,
      "drop_lowest_n": 0,
      "items": [
        {
          "id": "mst300-quiz-1",
          "name": "Quiz 1",
          "weight_percent": 2.5,
          "max_points": 100,
          "earned_points": null,
          "due_date": "2026-9-22",
          "status": "Not Started"
        },
        {
          "id": "mst300-quiz-2",
          "name": "Quiz 2",
          "weight_percent": 2.5,
          "max_points": 100,
          "earned_points": null,
          "due_date": "2026-10-06",
          "status": "Not Started"
        },
        {
          "id": "mst300-quiz-3",
          "name": "Quiz 3",
          "weight_percent": 2.5,
          "max_points": 100,
          "earned_points": null,
          "due_date": "2026-10-13",
          "status": "Not Started"
        },
        {
          "id": "mst300-quiz-4",
          "name": "Quiz 4",
          "weight_percent": 2.5,
          "max_points": 100,
          "earned_points": null,
          "due_date": "2026-11-10",
          "status": "Not Started"
        },
        {
          "id": "mst300-quiz-5",
          "name": "Quiz 5",
          "weight_percent": 2.5,
          "max_points": 100,
          "earned_points": null,
          "due_date": "2026-12-01",
          "status": "Not Started"
        },
        {
          "id": "mst300-quiz-6",
          "name": "Quiz 6",
          "weight_percent": 2.5,
          "max_points": 100,
          "earned_points": null,
          "due_date": "2026-12-08",
          "status": "Not Started"
        }
      ]
    },
    {
      "category_id": "projects",
      "name": "Projects",
      "weight_percent": 30.0,
      "drop_lowest_n": 0,
      "hurdle_min_percent": 50.0,
      "hurdle_description": "Weighted average of 50% or higher on all projects",
      "items": [
        {
          "id": "mst300-proj-1",
          "name": "Project 1",
          "weight_percent": 15.0,
          "max_points": 100,
          "earned_points": null,
          "due_date": "2026-11-03",
          "status": "Not Started"
        },
        {
          "id": "mst300-proj-2",
          "name": "Project 2",
          "weight_percent": 15.0,
          "max_points": 100,
          "earned_points": null,
          "due_date": "2026-12-08",
          "status": "Not Started"
        }
      ]
    },
    {
      "category_id": "tests",
      "name": "Tests",
      "weight_percent": 25.0,
      "drop_lowest_n": 0,
      "items": [
        {
          "id": "mst300-test-1",
          "name": "Midterm Test",
          "weight_percent": 10.0,
          "max_points": 100,
          "earned_points": null,
          "due_date": null,
          "status": "Not Started"
        },
        {
          "id": "mst300-test-2",
          "name": "Final Test",
          "weight_percent": 15.0,
          "max_points": 100,
          "earned_points": null,
          "due_date": null,
          "status": "Not Started"
        }
      ]
    }
  ],
  "hurdles": [
    {
      "type": "category_average",
      "target_category": "labs",
      "min_percentage": 50.0,
      "description": "Achieve a weighted average of 50% or higher on all labs"
    },
    {
      "type": "category_average",
      "target_category": "projects",
      "min_percentage": 50.0,
      "description": "Achieve a weighted average of 50% or higher on all projects"
    }
  ]
}